bom.csv

Item,Description / Variant,Qty,Unit Price (USD),Total Price (USD),Link
80W Digital Soldering Iron Kit, Thermostatic LCD Soldering Iron (Black Set 2 / 220V EU Plug) ,1,12.96, 12.96, https://www.aliexpress.com/item/1005012698877194.html?spm=a2g0o.cart.0.0.5bda38dalOWPCz&mp=1&pdp_npi=6%40dis%21USD%21USD+27.57%21USD+12.96%21%21USD+12.96%21%21%21%400b15841617930654812781543e0ff2%2112000059122624875%21ct%21NG%218492089707%21%211%210%21
Replacement Soldering Iron Tips, Mix-3 PCS Soldering Tips, 1,4.86, 4.86, https://www.aliexpress.com/item/1005012574368119.html?spm=a2g0o.cart.0.0.5bda38dalOWPCz&mp=1&pdp_npi=6%40dis%21USD%21USD+5.22%21USD+4.86%21%21USD+4.86%21%21%21%400b15841617930654812781543e0ff2%2112000058753240313%21ct%21NG%218492089707%21%211%210%21
M3 Nylon Standoff Kit, 50pcs M3x10mm Hexagonal Spacers ,1 ,2.51 ,2.51, https://www.aliexpress.com/item/1005008584184387.html?spm=a2g0o.cart.0.0.5bda38dalOWPCz&mp=1&pdp_npi=6%40dis%21USD%21USD+2.60%21USD+2.51%21%21USD+2.51%21%21%21%400b15841617930654812781543e0ff2%2112000045833074277%21ct%21NG%218492089707%21%211%210%21
Metric Bolt & Nut Assortment, 420pcs M2/M3/M4 Fastener Set (420PCSM2), 1, 5.63, 5.63, https://www.aliexpress.com/item/1005008584184387.html?spm=a2g0o.cart.0.0.5bda38dalOWPCz&mp=1&pdp_npi=6%40dis%21USD%21USD+2.60%21USD+2.51%21%21USD+2.51%21%21%21%400b15841617930654812781543e0ff2%2112000045833074277%21ct%21NG%218492089707%21%211%210%21
40-Pin DuPont Jumper Wire Kit, 120pcs 20cm Male-to-Male / Male-to-Female / Female-to-Female, 1, 4.27, 4.27, https://www.aliexpress.com/item/1005006205169394.html?spm=a2g0o.cart.0.0.5bda38dalOWPCz&mp=1&pdp_npi=6%40dis%21USD%21USD+12.01%21USD+4.27%21%21USD+4.27%21%21%21%400b15841617930654812781543e0ff2%2112000036267230291%21ct%21NG%218492089707%21%211%210%21
PLATO 170 Diagonal Wire Cutters, Electronic Flush Side Cutting Nippers, 1, 2.35, 2.35, https://www.aliexpress.com/item/1005007465091242.html?spm=a2g0o.cart.0.0.5bda38dalOWPCz&mp=1&pdp_npi=6%40dis%21USD%21USD+2.35%21USD+2.35%21%21USD+2.35%21%21%21%400b15841617930654812781543e0ff2%2112000040864974557%21ct%21NG%218492089707%21%211%210%21
ANENG SZ308 Digital Multimeter, Square Wave Tester 1999 Counts with Transistor/Buzzer (Red), 1, 5.86, 5.86, https://www.aliexpress.com/item/1005007428133018.html?spm=a2g0o.cart.0.0.5bda38dalOWPCz&mp=1&pdp_npi=6%40dis%21USD%21USD+5.86%21USD+5.86%21%21USD+5.86%21%21%21%400b15841617930654812781543e0ff2%2112000040719267912%21ct%21NG%218492089707%21%211%210%21
KCD11 SPST Mini Rocker Switches, 2-Pin 10x15mm Power Switches (5pcs), 1, 1.92, 1.92, www.aliexpress.com/item/1005008778176373.html?spm=a2g0o.cart.0.0.5bda38dalOWPCz&mp=1&pdp_npi=6%40dis!USD!USD+1.92!USD+1.92!!USD+1.92!!!%400b15841617930654812781543e0ff2!12000046629830176!ct!NG!8492089707!!1!0!
18650 Battery USB Charger, 2-Slot Dual Lithium USB Charger (1pc), 1, 2.36, 2.36, https://www.aliexpress.com/item/1005013347376760.html?spm=a2g0o.cart.0.0.5bda38dalOWPCz&mp=1&pdp_npi=6%40dis%21USD%21USD+7.88%21USD+2.36%21%21USD+2.36%21%21%21%400b15841617930654812781543e0ff2%2112000060918440344%21ct%21NG%218492089707%21%211%210%21
18650 Battery Holder, 2-Slot 2S Series Battery Storage Case with Leads, 1, 1.08, 1.08, https://www.aliexpress.com/item/1005008625133461.html?spm=a2g0o.cart.0.0.5bda38dalOWPCz&mp=1&pdp_npi=6%40dis%21USD%21USD+1.08%21USD+1.08%21%21USD+1.08%21%21%21%400b15841617930654812781543e0ff2%2112000046003950474%21ct%21NG%218492089707%21%211%210%21
LM2596 DC-DC Buck Converter, Step-Down Regulator with Onboard LED Voltmeter Display, 1, 1.83, 1.83, https://www.aliexpress.com/item/1005007055625007.html?spm=a2g0o.cart.0.0.5bda38dalOWPCz&mp=1&pdp_npi=6%40dis%21USD%21USD+1.83%21USD+1.83%21%21USD+1.83%21%21%21%400b15841617930654812781543e0ff2%2112000039252295039%21ct%21NG%218492089707%21%211%210%21
L298N Dual H-Bridge Motor Driver, Dual Motor Controller Board for DC Motors, 2, 2.00, 4.00, https://www.aliexpress.com/item/32392774289.html?spm=a2g0o.cart.0.0.5bda38dalOWPCz&mp=1&pdp_npi=6%40dis%21USD%21USD+2.00%21USD+2.00%21%21USD+2.00%21%21%21%400b15841617930654812781543e0ff2%2157692613834%21ct%21NG%218492089707%21%212%210%21
ESP32 DevKit Development Board, ESP32 Type-C USB (CH340C Dual Core Wi-Fi + BLE), 1, 3.93, 3.93, https://www.aliexpress.com/item/1005004685935016.html?spm=a2g0o.cart.0.0.5bda38dalOWPCz&mp=1&pdp_npi=6%40dis%21USD%21USD+3.93%21USD+3.93%21%21USD+3.93%21%21%21%400b15841617930654812781543e0ff2%2112000030095280306%21ct%21NG%218492089707%21%211%210%21
TT Gearmotors & 65mm Wheels, 2 lots (4x Yellow TT Motors + 4x Rubber Wheels), 2, 1.12, 2.24, https://www.aliexpress.com/item/1005007519207278.html?spm=a2g0o.cart.0.0.5bda38dalOWPCz&mp=1&pdp_npi=6%40dis%21USD%21USD+1.51%21USD+1.12%21%21USD+1.12%21%21%21%400b15841617930654812781543e0ff2%2112000041105202780%21ct%21NG%218492089707%21%212%210%21
Rosin Soldering Flux Paste, 10g Plastic Box Lead-Free No-Clean Solder Rosin (2pcs), 1, 1.46, 1.46, https://www.aliexpress.com/item/1005008462401971.html?spm=a2g0o.cart.0.0.5bda38dalOWPCz&mp=1&pdp_npi=6%40dis%21USD%21USD+3.66%21USD+1.46%21%21USD+1.46%21%21%21%400b15841617930654812781543e0ff2%2112000045240051644%21ct%21NG%218492089707%21%211%210%21
Consolidated Shipping, AliExpress Standard Shipping to Lagos Nigeria, 1, 10.83, 10.83, ---
TOTAL,,, 68.09, 68.09,

README.md

Item,Description / Variant,Qty,Unit Price (USD),Total Price (USD),Link
80W Digital Soldering Iron Kit, Thermostatic LCD Soldering Iron (Black Set 2 / 220V EU Plug) ,1,12.96, 12.96, https://www.aliexpress.com/item/1005012698877194.html?spm=a2g0o.cart.0.0.5bda38dalOWPCz&mp=1&pdp_npi=6%40dis%21USD%21USD+27.57%21USD+12.96%21%21USD+12.96%21%21%21%400b15841617930654812781543e0ff2%2112000059122624875%21ct%21NG%218492089707%21%211%210%21
Replacement Soldering Iron Tips, Mix-3 PCS Soldering Tips, 1,4.86, 4.86, https://www.aliexpress.com/item/1005012574368119.html?spm=a2g0o.cart.0.0.5bda38dalOWPCz&mp=1&pdp_npi=6%40dis%21USD%21USD+5.22%21USD+4.86%21%21USD+4.86%21%21%21%400b15841617930654812781543e0ff2%2112000058753240313%21ct%21NG%218492089707%21%211%210%21
M3 Nylon Standoff Kit, 50pcs M3x10mm Hexagonal Spacers ,1 ,2.51 ,2.51, https://www.aliexpress.com/item/1005008584184387.html?spm=a2g0o.cart.0.0.5bda38dalOWPCz&mp=1&pdp_npi=6%40dis%21USD%21USD+2.60%21USD+2.51%21%21USD+2.51%21%21%21%400b15841617930654812781543e0ff2%2112000045833074277%21ct%21NG%218492089707%21%211%210%21
Metric Bolt & Nut Assortment, 420pcs M2/M3/M4 Fastener Set (420PCSM2), 1, 5.63, 5.63, https://www.aliexpress.com/item/1005008584184387.html?spm=a2g0o.cart.0.0.5bda38dalOWPCz&mp=1&pdp_npi=6%40dis%21USD%21USD+2.60%21USD+2.51%21%21USD+2.51%21%21%21%400b15841617930654812781543e0ff2%2112000045833074277%21ct%21NG%218492089707%21%211%210%21
40-Pin DuPont Jumper Wire Kit, 120pcs 20cm Male-to-Male / Male-to-Female / Female-to-Female, 1, 4.27, 4.27, https://www.aliexpress.com/item/1005006205169394.html?spm=a2g0o.cart.0.0.5bda38dalOWPCz&mp=1&pdp_npi=6%40dis%21USD%21USD+12.01%21USD+4.27%21%21USD+4.27%21%21%21%400b15841617930654812781543e0ff2%2112000036267230291%21ct%21NG%218492089707%21%211%210%21
PLATO 170 Diagonal Wire Cutters, Electronic Flush Side Cutting Nippers, 1, 2.35, 2.35, https://www.aliexpress.com/item/1005007465091242.html?spm=a2g0o.cart.0.0.5bda38dalOWPCz&mp=1&pdp_npi=6%40dis%21USD%21USD+2.35%21USD+2.35%21%21USD+2.35%21%21%21%400b15841617930654812781543e0ff2%2112000040864974557%21ct%21NG%218492089707%21%211%210%21
ANENG SZ308 Digital Multimeter, Square Wave Tester 1999 Counts with Transistor/Buzzer (Red), 1, 5.86, 5.86, https://www.aliexpress.com/item/1005007428133018.html?spm=a2g0o.cart.0.0.5bda38dalOWPCz&mp=1&pdp_npi=6%40dis%21USD%21USD+5.86%21USD+5.86%21%21USD+5.86%21%21%21%400b15841617930654812781543e0ff2%2112000040719267912%21ct%21NG%218492089707%21%211%210%21
KCD11 SPST Mini Rocker Switches, 2-Pin 10x15mm Power Switches (5pcs), 1, 1.92, 1.92, www.aliexpress.com/item/1005008778176373.html?spm=a2g0o.cart.0.0.5bda38dalOWPCz&mp=1&pdp_npi=6%40dis!USD!USD+1.92!USD+1.92!!USD+1.92!!!%400b15841617930654812781543e0ff2!12000046629830176!ct!NG!8492089707!!1!0!
18650 Battery USB Charger, 2-Slot Dual Lithium USB Charger (1pc), 1, 2.36, 2.36, https://www.aliexpress.com/item/1005013347376760.html?spm=a2g0o.cart.0.0.5bda38dalOWPCz&mp=1&pdp_npi=6%40dis%21USD%21USD+7.88%21USD+2.36%21%21USD+2.36%21%21%21%400b15841617930654812781543e0ff2%2112000060918440344%21ct%21NG%218492089707%21%211%210%21
18650 Battery Holder, 2-Slot 2S Series Battery Storage Case with Leads, 1, 1.08, 1.08, https://www.aliexpress.com/item/1005008625133461.html?spm=a2g0o.cart.0.0.5bda38dalOWPCz&mp=1&pdp_npi=6%40dis%21USD%21USD+1.08%21USD+1.08%21%21USD+1.08%21%21%21%400b15841617930654812781543e0ff2%2112000046003950474%21ct%21NG%218492089707%21%211%210%21
LM2596 DC-DC Buck Converter, Step-Down Regulator with Onboard LED Voltmeter Display, 1, 1.83, 1.83, https://www.aliexpress.com/item/1005007055625007.html?spm=a2g0o.cart.0.0.5bda38dalOWPCz&mp=1&pdp_npi=6%40dis%21USD%21USD+1.83%21USD+1.83%21%21USD+1.83%21%21%21%400b15841617930654812781543e0ff2%2112000039252295039%21ct%21NG%218492089707%21%211%210%21
L298N Dual H-Bridge Motor Driver, Dual Motor Controller Board for DC Motors, 2, 2.00, 4.00, https://www.aliexpress.com/item/32392774289.html?spm=a2g0o.cart.0.0.5bda38dalOWPCz&mp=1&pdp_npi=6%40dis%21USD%21USD+2.00%21USD+2.00%21%21USD+2.00%21%21%21%400b15841617930654812781543e0ff2%2157692613834%21ct%21NG%218492089707%21%212%210%21
ESP32 DevKit Development Board, ESP32 Type-C USB (CH340C Dual Core Wi-Fi + BLE), 1, 3.93, 3.93, https://www.aliexpress.com/item/1005004685935016.html?spm=a2g0o.cart.0.0.5bda38dalOWPCz&mp=1&pdp_npi=6%40dis%21USD%21USD+3.93%21USD+3.93%21%21USD+3.93%21%21%21%400b15841617930654812781543e0ff2%2112000030095280306%21ct%21NG%218492089707%21%211%210%21
TT Gearmotors & 65mm Wheels, 2 lots (4x Yellow TT Motors + 4x Rubber Wheels), 2, 1.12, 2.24, https://www.aliexpress.com/item/1005007519207278.html?spm=a2g0o.cart.0.0.5bda38dalOWPCz&mp=1&pdp_npi=6%40dis%21USD%21USD+1.51%21USD+1.12%21%21USD+1.12%21%21%21%400b15841617930654812781543e0ff2%2112000041105202780%21ct%21NG%218492089707%21%212%210%21
Rosin Soldering Flux Paste, 10g Plastic Box Lead-Free No-Clean Solder Rosin (2pcs), 1, 1.46, 1.46, https://www.aliexpress.com/item/1005008462401971.html?spm=a2g0o.cart.0.0.5bda38dalOWPCz&mp=1&pdp_npi=6%40dis%21USD%21USD+3.66%21USD+1.46%21%21USD+1.46%21%21%21%400b15841617930654812781543e0ff2%2112000045240051644%21ct%21NG%218492089707%21%211%210%21
Consolidated Shipping, AliExpress Standard Shipping to Lagos Nigeria, 1, 10.83, 10.83, ---
TOTAL,,, 68.09, 68.09,

Total Project Cost: $68.09 USD (including toolkit and no spear hardware).